Symbol,Name,Last Sale,Net Change,% Change,Market Cap,Country,IPO Year,Volume,Sector,Industry
IIVIP,II-VI Incorporated 6.00% Series A Mandatory Convertible Preferred Stock,$282.32,-6.16,-2.135%,0.00,United States,,606,Capital Goods,Industrial Machinery/Components
IKNA,Ikena Oncology Inc. Common Stock,$13.71,0.44,3.316%,491520514.00,United States,2021,24886,Health Care,Major Pharmaceuticals
IKNX,Ikonics Corporation,$10.46,0.03,0.288%,20688353.00,United States,,3565,Miscellaneous,Industrial Machinery/Components
IKT,Inhibikase Therapeutics Inc. Common Stock,$2.8512,-0.0488,-1.683%,28892193.00,United States,2020,1184736,Health Care,Major Pharmaceuticals
ILMN,Illumina Inc. Common Stock,$464.42,8.26,1.811%,67805320000.00,United States,2000,197344,Health Care,Medical Specialities
ILPT,Industrial Logistics Properties Trust Common Shares of Beneficial Interest,$26.12,0.61,2.391%,1705664419.00,United States,2018,116112,Consumer Services,Real Estate Investment Trusts
IMAB,I-MAB American Depositary Shares,$76.455,3.045,4.148%,5752621299.00,China,2020,323970,Health Care,Major Pharmaceuticals
IMAC,IMAC Holdings Inc. Common Stock,$2.03,-0.01,-0.49%,51156976.00,United States,2019,24143,Health Care,Medical Specialities
IMACW,IMAC Holdings Inc. Warrant,$0.70,-0.0299,-4.096%,0.00,United States,2019,900,Health Care,Medical Specialities
IMBI,iMedia Brands Inc. Class A Common Stock,$8.015,0.595,8.019%,171221776.00,United States,,187700,Consumer Services,Catalog/Specialty Distribution
IMCC,IM Cannabis Corp. Common Shares,$5.67,0.11,1.978%,323573581.00,Canada,,46080,,
IMCR,Immunocore Holdings plc American Depositary Shares,$39.26,-1.71,-4.174%,1719041815.00,United Kingdom,2021,6469,Health Care,Biotechnology: Biological Products (No Diagnostic Substances)
IMGN,ImmunoGen Inc. Common Stock,$6.48,-0.21,-3.139%,1295625145.00,United States,1989,1146305,Health Care,Major Pharmaceuticals
IMKTA,Ingles Markets Incorporated Class A Common Stock,$60.33,0.61,1.021%,1145930704.00,United States,1987,77131,Consumer Services,Food Chains
IMMP,Immutep Limited American Depositary Shares,$4.38,-0.31,-6.61%,284141673.00,Australia,,873927,Health Care,Major Pharmaceuticals
IMMR,Immersion Corporation Common Stock,$8.5079,0.2479,3.001%,262771094.00,United States,1999,185720,Technology,Computer peripheral equipment
IMNM,Immunome Inc. Common Stock,$16.88,0.36,2.179%,198462464.00,United States,2020,12310,Consumer Durables,Specialty Chemicals
IMOS,ChipMOS TECHNOLOGIES INC. American Depositary Shares,$33.6783,-0.2917,-0.859%,1224610547.00,Taiwan,,6466,Technology,Semiconductors
IMPL,Impel NeuroPharma Inc. Common Stock,$9.51,0.00,0.00%,211847337.00,United States,2021,34591,Health Care,Major Pharmaceuticals
IMRA,IMARA Inc. Common Stock,$7.62,0.11,1.465%,134420549.00,United States,2020,21799,Health Care,Biotechnology: Biological Products (No Diagnostic Substances)
IMTE,Integrated Media Technology Limited Ordinary Shares,$4.22,-0.02,-0.472%,35619049.00,Australia,,85769,Consumer Non-Durables,Consumer Electronics/Appliances
IMTX,Immatics N.V. Ordinary Shares,$11.68,-0.12,-1.017%,734772647.00,Germany,,16299,Health Care,Biotechnology: Biological Products (No Diagnostic Substances)
IMTXW,Immatics N.V. Warrants,$3.22,-0.39,-10.803%,0.00,Germany,,777,Health Care,Biotechnology: Biological Products (No Diagnostic Substances)
IMUX,Immunic Inc. Common Stock,$12.40,-0.60,-4.615%,269693044.00,United States,2014,115788,Health Care,Major Pharmaceuticals
IMV,IMV Inc. Common Shares,$2.34,-0.05,-2.092%,158642483.00,Canada,,40030,,
IMVT,Immunovant Inc. Common Stock,$11.29,0.06,0.534%,923654398.00,United States,2019,214995,Health Care,Major Pharmaceuticals
IMXI,International Money Express Inc. Common Stock,$15.64,0.11,0.708%,612197896.00,United States,2017,73211,Technology,EDP Services
INBK,First Internet Bancorp Common Stock,$31.27,1.05,3.475%,308134643.00,United States,,14860,Finance,Major Banks
INBKZ,First Internet Bancorp 6.0% Fixed-to-Floating Rate Subordinated Notes Due 2029,$26.24,0.18,0.691%,0.00,United States,,3459,Finance,Major Banks
INBX,Inhibrx Inc. Common Stock,$26.27,-0.30,-1.129%,993288429.00,United States,2020,56116,Health Care,Major Pharmaceuticals
INCY,Incyte Corp. Common Stock,$85.04,1.08,1.286%,18702292484.00,United States,,488507,Health Care,Biotechnology: Commercial Physical & Biological Resarch
INDB,Independent Bank Corp. Common Stock,$77.82,2.36,3.127%,2570468840.00,United States,,93543,Finance,Major Banks
INDI,indie Semiconductor Inc. Class A Common Stock,$8.839,-0.241,-2.654%,897003517.00,United States,,270256,,
INDIW,indie Semiconductor Inc. Warrant,$1.88,-0.12,-6.00%,0.00,United States,,111350,,
INDT,INDUS Realty Trust Inc. (MD) Common Stock,$67.06,0.25,0.374%,517503227.00,United States,,5429,Finance,Real Estate
INFI,Infinity Pharmaceuticals Inc. Common Stock,$3.325,0.005,0.151%,294752076.00,United States,,640581,Health Care,Major Pharmaceuticals
INFN,Infinera Corporation Common Stock,$9.89,0.12,1.228%,2027416275.00,United States,2007,601336,Public Utilities,Telecommunications Equipment
INGN,Inogen Inc Common Stock,$67.14,0.19,0.284%,1503624470.00,United States,2014,49700,Health Care,Industrial Specialties
INKA,KludeIn I Acquisition Corp. Class A Common Stock,$9.78,-0.01,-0.102%,210881250.00,United States,2021,1397,,
INKAU,KludeIn I Acquisition Corp. Unit,$10.15,0.00,0.00%,0.00,United States,2021,548,,
INKAW,KludeIn I Acquisition Corp. Warrant,$0.73,-0.01,-1.351%,0.00,United States,2021,2404,Finance,Business Services
INM,InMed Pharmaceuticals Inc. Common Shares,$2.76,0.01,0.364%,22219951.00,Canada,,29802,,
INMB,INmune Bio Inc. Common stock,$17.31,-0.15,-0.859%,261816710.00,United States,2019,57163,Health Care,Major Pharmaceuticals
INMD,InMode Ltd. Ordinary Shares,$93.411,2.821,3.114%,3567445583.00,Israel,2019,296730,Health Care,Medical/Nursing Services
INNV,InnovAge Holding Corp. Common Stock,$22.96,-0.13,-0.563%,3111459138.00,United States,2021,51967,Health Care,Hospital/Nursing Management
INO,Inovio Pharmaceuticals Inc. Common Stock,$8.71,0.22,2.591%,1823867555.00,United States,,1697830,Health Care,Biotechnology: Biological Products (No Diagnostic Substances)
INOD,Innodata Inc. Common Stock,$7.30,-0.03,-0.409%,192112735.00,United States,1993,43569,Technology,EDP Services
INOV,Inovalon Holdings Inc. Class A Common Stock,$32.75,0.66,2.057%,5105503741.00,United States,2015,139655,Technology,EDP Services
INPX,Inpixon Common Stock,$1.065,-0.035,-3.182%,119046366.00,United States,2014,1673034,Technology,Computer Software: Prepackaged Software
INSE,Inspired Entertainment Inc. Common Stock,$11.85,0.43,3.765%,275137128.00,United States,2014,93346,,
INSG,Inseego Corp. Common Stock,$10.1617,-0.0283,-0.278%,1044882280.00,United States,,714197,Capital Goods,Telecommunications Equipment
INSM,Insmed Inc. Common Stock,$28.49,-0.61,-2.096%,3276122279.00,United States,,319061,Health Care,Major Pharmaceuticals
INTC,Intel Corporation Common Stock,$55.955,0.285,0.512%,225946290000.00,United States,,9097782,Technology,Semiconductors
INTG,Intergroup Corporation (The) Common Stock,$41.77,0.00,0.00%,93427544.00,United States,,326,Consumer Services,Hotels/Resorts
INTU,Intuit Inc. Common Stock,$479.59,6.19,1.308%,131052411381.00,United States,1993,396179,Technology,Computer Software: Prepackaged Software
INTZ,Intrusion Inc. Common Stock,$13.37,-0.78,-5.512%,235579480.00,United States,,82913,Miscellaneous,Diversified Manufacture
INVA,Innoviva Inc. Common Stock,$13.29,-0.04,-0.30%,922362574.00,United States,,193109,Health Care,Major Pharmaceuticals
INVE,Identiv Inc. Common Stock,$16.79,0.73,4.545%,369101185.00,United States,,169164,Technology,Computer peripheral equipment
INVO,INVO BioScience Inc. Common Stock,$4.18,0.03,0.723%,43676966.00,United States,,19331,Health Care,Medical/Dental Instruments
INVZ,Innoviz Technologies Ltd. Ordinary shares,$10.43,-0.22,-2.066%,1354032644.00,Israel,,300608,Capital Goods,Auto Parts:O.E.M.
INVZW,Innoviz Technologies Ltd. Warrant,$2.62,-0.15,-5.415%,0.00,Israel,,10476,Capital Goods,Auto Parts:O.E.M.
INZY,Inozyme Pharma Inc. Common Stock,$14.85,-0.58,-3.759%,348723931.00,United States,2020,25048,Health Care,Major Pharmaceuticals
IONS,Ionis Pharmaceuticals Inc. Common Stock,$36.71,-1.08,-2.858%,5174752758.00,United States,,430060,Health Care,Major Pharmaceuticals
IOSP,Innospec Inc. Common Stock,$93.30,1.75,1.912%,2295949259.00,United States,,26100,Basic Industries,Industrial Specialties
IOVA,Iovance Biotherapeutics Inc. Common Stock,$24.89,0.11,0.444%,3804418629.00,United States,,536720,Health Care,Biotechnology: Biological Products (No Diagnostic Substances)
IPA,ImmunoPrecise Antibodies Ltd. Common Stock,$6.64,-0.13,-1.92%,126684560.00,Canada,,19980,,
IPAR,Inter Parfums Inc. Common Stock,$71.94,0.32,0.447%,2277047614.00,United States,,38042,Consumer Non-Durables,Package Goods/Cosmetics
IPDN,Professional Diversity Network Inc. Common Stock,$1.55,-0.04,-2.516%,20870784.00,United States,2013,83571,Technology,EDP Services
IPGP,IPG Photonics Corporation Common Stock,$205.86,2.42,1.19%,11029692655.00,United States,2006,76332,Technology,Semiconductors
IPHA,Innate Pharma S.A. ADS,$3.75,0.15,4.167%,296283619.00,France,2019,24000,Health Care,Major Pharmaceuticals
IPLDP,Interstate Power & Light Company Perp Prd Ser D,$26.20,0.05,0.191%,0.00,United States,,2361,Public Utilities,Power Generation
IPSC,Century Therapeutics Inc. Common Stock,$24.22,1.39,6.088%,1327852006.00,United States,,282097,,
IPVI,InterPrivate IV InfraTech Partners Inc. Class A Common Stock,$9.80,-0.04,-0.407%,0.00,United States,2021,3291,,
IPVIU,InterPrivate IV InfraTech Partners Inc. Units,$9.95,-0.03,-0.301%,0.00,United States,2021,501,Finance,Business Services
IPVIW,InterPrivate IV InfraTech Partners Inc. Warrant,$0.9601,0.0101,1.063%,0.00,United States,2021,5001,Finance,Business Services
IPW,iPower Inc. Common Stock,$7.4599,0.1099,1.495%,189992433.00,United States,2021,28865,Consumer Services,Catalog/Specialty Distribution
IPWR,Ideal Power Inc. Common Stock,$11.7451,-0.6149,-4.975%,68967767.00,United States,2013,44156,Capital Goods,Industrial Machinery/Components
IQ,iQIYI Inc. American Depositary Shares,$14.44,-0.17,-1.164%,11397274072.00,China,2018,2534636,Technology,Internet and Information Services
IRBT,iRobot Corporation Common Stock,$94.17,-0.83,-0.874%,2645705585.00,United States,2005,181832,,
IRCP,IRSA Propiedades Comerciales S.A. American Depositary Shares,$10.4865,0.1065,1.026%,330361579.00,Argentina,,4446,Consumer Services,Building operators
IRDM,Iridium Communications Inc Common Stock,$40.17,0.84,2.136%,5361844882.00,United States,,197788,Consumer Services,Telecommunications Equipment
IRIX,IRIDEX Corporation Common Stock,$7.06,0.06,0.857%,110318148.00,United States,1996,23795,Health Care,Biotechnology: Electromedical & Electrotherapeutic Apparatus
IRMD,iRadimed Corporation Common Stock,$28.305,-0.495,-1.719%,348504775.00,United States,2014,4397,Health Care,Medical/Dental Instruments
IROQ,IF Bancorp Inc. Common Stock,$22.87,0.00,0.00%,74107399.00,United States,2011,28,Finance,Finance: Consumer Services
IRTC,iRhythm Technologies Inc. Common Stock,$63.87,-1.04,-1.602%,1871585804.00,United States,2016,193724,Health Care,Medical/Dental Instruments
IRWD,Ironwood Pharmaceuticals Inc. Class A Common Stock,$12.035,0.315,2.688%,1949269680.00,United States,2010,581724,Health Care,Major Pharmaceuticals
ISAA,Iron Spark I Inc. Class A Common Stock,$9.96,-0.02,-0.20%,197606400.00,United States,2021,26529,,
ISBC,Investors Bancorp Inc. Common Stock,$14.39,0.57,4.124%,3563972825.00,United States,,621684,Finance,Savings Institutions
ISEE,IVERIC bio Inc. Common Stock,$5.75,-0.12,-2.044%,518966917.00,United States,2013,335616,Health Care,Major Pharmaceuticals
ISIG,Insignia Systems Inc. Common Stock,$7.64,-0.20,-2.551%,13400789.00,United States,1991,754,Technology,Advertising
ISLE,Isleworth Healthcare Acquisition Corporation Common stock,$9.77,-0.01,-0.102%,255888513.00,United States,2021,1717,,
ISLEW,Isleworth Healthcare Acquisition Corporation Warrant,$0.6767,0.0067,1.00%,0.00,United States,2021,3100,Consumer Services,Hotels/Resorts
ISNS,Image Sensing Systems Inc. Common Stock,$6.82,0.00,0.00%,36516578.00,United States,1995,59540,Capital Goods,Industrial Machinery/Components
ISPC,iSpecimen Inc. Common Stock,$7.39,-0.10,-1.335%,46116194.00,United States,2021,222102,,
ISRG,Intuitive Surgical Inc. Common Stock,$898.685,19.825,2.256%,106415886252.00,United States,2000,208774,Health Care,Medical/Dental Instruments
ISSC,Innovative Solutions and Support Inc. Common Stock,$5.82,-0.07,-1.188%,100347695.00,United States,2000,641,Capital Goods,Military/Government/Technical
ISTR,Investar Holding Corporation Common Stock,$22.26,0.10,0.451%,231800748.00,United States,2014,24721,Finance,Commercial Banks
ISUN,iSun Inc. Common Stock,$11.17,-0.46,-3.955%,101510357.00,United States,2016,212320,Technology,Semiconductors
ITAC,Industrial Tech Acquisitions Inc. Class A common stock,$10.00,-0.08,-0.794%,96807360.00,United States,2020,7074,,
ITACU,Industrial Tech Acquisitions Inc. Unit,$11.1539,-0.0461,-0.412%,0.00,United States,2020,525,,
ITACW,Industrial Tech Acquisitions Inc. Warrant,$1.14,0.02,1.786%,0.00,United States,2020,33463,,
ITCI,Intra-Cellular Therapies Inc. Common Stock,$43.715,0.535,1.239%,3549755310.00,United States,,104340,Health Care,Major Pharmaceuticals
ITHX,ITHAX Acquisition Corp. Class A Ordinary Shares,$9.69,0.00,0.00%,299057625.00,United States,2021,103,Finance,Business Services
ITHXU,ITHAX Acquisition Corp. Unit,$9.98,0.00,0.00%,0.00,United States,2021,13601,Finance,Business Services
ITHXW,ITHAX Acquisition Corp. Warrant,$0.66,-0.01,-1.493%,0.00,United States,2021,1000,Finance,Business Services
ITI,Iteris Inc. Common Stock,$7.275,-0.095,-1.289%,304443021.00,United States,,100906,Capital Goods,Telecommunications Equipment
ITIC,Investors Title Company Common Stock,$170.3399,-0.0001,0.00%,322644552.00,United States,,4131,Finance,Specialty Insurers
ITMR,Itamar Medical Ltd. American Depository Shares,$21.95,0.35,1.62%,359697218.00,Israel,,12493,Health Care,Medical/Dental Instruments
ITOS,iTeos Therapeutics Inc. Common Stock,$24.91,-0.16,-0.638%,874440615.00,United States,2020,322453,Consumer Durables,Specialty Chemicals
ITQ,Itiquira Acquisition Corp. Class A Ordinary Shares,$9.67,0.01,0.104%,278012500.00,United States,2021,180000,Finance,Business Services
ITQRU,Itiquira Acquisition Corp. Unit,$9.99,0.00,0.00%,0.00,United States,2021,50,Finance,Business Services
ITQRW,Itiquira Acquisition Corp. Warrant,$0.65,0.00,0.00%,0.00,United States,2021,1,Finance,Business Services
ITRI,Itron Inc. Common Stock,$97.12,2.14,2.253%,4383279277.00,United States,1993,66164,Capital Goods,Electrical Products
ITRM,Iterum Therapeutics plc Ordinary Share,$2.01,-0.02,-0.985%,360068926.00,Ireland,2018,6554378,Health Care,Major Pharmaceuticals
ITRN,Ituran Location and Control Ltd. Ordinary Shares,$27.26,0.59,2.212%,567370722.00,Israel,2005,22086,Technology,Electronic Components
IVA,Inventiva S.A. American Depository Shares,$14.10,-0.43,-2.959%,544686680.00,France,2020,8386,Consumer Services,Other Consumer Services
IVAC,Intevac Inc. Common Stock,$6.49,-0.19,-2.844%,156553175.00,United States,1995,34683,,
IZEA,IZEA Worldwide Inc. Common Stock,$2.6008,0.0408,1.594%,160538539.00,United States,,682237,Technology,Advertising
JACK,Jack In The Box Inc. Common Stock,$118.20,1.96,1.686%,2627366857.00,United States,,111049,Consumer Services,Restaurants
JAGX,Jaguar Health Inc. Common Stock,$1.6031,-0.0169,-1.043%,220138144.00,United States,2015,3433078,Health Care,Major Pharmaceuticals
JAKK,JAKKS Pacific Inc. Common Stock,$11.12,0.42,3.925%,71121441.00,United States,1996,80349,Consumer Non-Durables,Recreational Products/Toys
JAMF,Jamf Holding Corp. Common Stock,$32.55,0.04,0.123%,3837151998.00,United States,2020,245473,Technology,Computer Software: Prepackaged Software
JAN,JanOne Inc. Common Stock (NV),$8.56,0.37,4.518%,24168390.00,United States,,154948,Public Utilities,Environmental Services
JANX,Janux Therapeutics Inc. Common Stock,$19.43,-0.25,-1.27%,808511639.00,United States,2021,35097,,
JAZZ,Jazz Pharmaceuticals plc Common Stock (Ireland),$176.91,-0.37,-0.209%,10737384209.00,Ireland,2007,249322,Health Care,Major Pharmaceuticals
JBHT,J.B. Hunt Transport Services Inc. Common Stock,$159.11,3.22,2.066%,16813313765.00,United States,,163245,Transportation,Trucking Freight/Courier Services
JBLU,JetBlue Airways Corporation Common Stock,$17.305,-0.005,-0.029%,5479401312.00,United States,2002,2932862,Transportation,Air Freight/Delivery Services
JBSS,John B. Sanfilippo & Son Inc. Common Stock,$89.77,0.45,0.504%,1029512702.00,United States,1991,6930,Consumer Non-Durables,Specialty Foods
JCIC,Jack Creek Investment Corp. Class A Ordinary Shares,$9.66,-0.02,-0.207%,416587500.00,United States,2021,691,Finance,Business Services
JCICU,Jack Creek Investment Corp. Units,$10.0776,0.0676,0.675%,0.00,United States,2021,1522,Finance,Business Services
JCICW,Jack Creek Investment Corp. Warrants,$0.8498,0.0998,13.307%,0.00,United States,2021,3474,Finance,Business Services
JCOM,j2 Global Inc. Common Stock,$135.50,4.01,3.05%,6112702829.00,United States,1999,153780,Technology,Telecommunications Equipment
JCS,Communications Systems Inc. Common Stock,$6.72,0.01,0.149%,63641256.00,United States,,6513,Public Utilities,Telecommunications Equipment
JCTCF,Jewett-Cameron Trading Company Common Shares,$9.98,0.06,0.605%,34821827.00,United States,,212,,
JD,JD.com Inc. American Depositary Shares,$72.575,0.955,1.333%,113143355172.00,China,2014,4814243,Miscellaneous,Business Services
JFIN,Jiayin Group Inc. American Depositary Shares,$5.7783,0.4483,8.411%,312172658.00,China,2019,204333,Finance,Finance: Consumer Services
JFU,9F Inc. American Depositary Shares,$2.2208,-0.4292,-16.196%,451956520.00,China,2019,2193631,Finance,Finance: Consumer Services
JG,Aurora Mobile Limited American Depositary Shares,$2.94,-0.06,-2.00%,346665325.00,China,2018,253739,Technology,EDP Services
JJSF,J & J Snack Foods Corp. Common Stock,$172.42,-0.51,-0.295%,3282181603.00,United States,1986,27871,Consumer Non-Durables,Specialty Foods
JKHY,Jack Henry & Associates Inc. Common Stock,$167.155,2.605,1.583%,12400489789.00,United States,1985,226797,Technology,Retail: Computer Software & Peripheral Equipment
JMPNL,JMP Group LLC 7.25% Senior Notes due 2027,$25.4101,-0.0399,-0.157%,0.00,United States,,913,Finance,Investment Bankers/Brokers/Service
JMPNZ,JMP Group LLC 6.875% Senior Notes due 2029,$25.13,0.03,0.12%,0.00,United States,,4600,Finance,Investment Bankers/Brokers/Service
JNCE,Jounce Therapeutics Inc. Common Stock,$7.48,0.21,2.889%,383038510.00,United States,2017,147020,Health Care,Major Pharmaceuticals
JOAN,JOANN Inc. Common Stock,$15.15,0.70,4.844%,638722470.00,United States,2021,185958,Consumer Non-Durables,Department/Specialty Retail Stores
JOBS,51job Inc. American Depositary Shares,$76.78,2.13,2.853%,5177500673.00,China,2004,3371570,Technology,Diversified Commercial Services
JOFF,JOFF Fintech Acquisition Corp. Class A Common Stock,$9.74,0.01,0.103%,403236000.00,United States,2021,12665,,
JOFFU,JOFF Fintech Acquisition Corp. Unit,$9.98,-0.03,-0.30%,0.00,United States,2021,280,,
JOFFW,JOFF Fintech Acquisition Corp. Warrant,$0.88,-0.0097,-1.09%,0.00,United States,2021,4235,Finance,Business Services
JOUT,Johnson Outdoors Inc. Class A Common Stock,$119.00,0.11,0.093%,1204064372.00,United States,,23888,Consumer Non-Durables,Recreational Products/Toys
JRJC,China Finance Online Co. Limited American Depositary Shares,$9.58,0.08,0.842%,23393977.00,China,2004,4133,Finance,Investment Bankers/Brokers/Service
JRSH,Jerash Holdings (US) Inc. Common Stock,$6.35,-0.06,-0.936%,71913750.00,United States,2018,5827,Basic Industries,Industrial Specialties
JRVR,James River Group Holdings Ltd. Common Shares,$36.365,0.445,1.239%,1355411917.00,Bermuda,2014,48939,Finance,Property-Casualty Insurers
JSM,Navient Corporation 6% Senior Notes due December 15 2043,$25.1866,-0.0134,-0.053%,0.00,United States,,8468,Finance,Finance: Consumer Services
JUGGU,Jaws Juggernaut Acquisition Corporation Unit,$10.08,0.03,0.299%,0.00,United States,,173056,,
JUPW,Jupiter Wellness Inc. Common Stock,$4.225,-0.095,-2.199%,48208044.00,United States,2020,37916,Health Care,Major Pharmaceuticals
JUPWW,Jupiter Wellness Inc. Warrant,$1.245,0.0449,3.741%,0.00,United States,2020,3775,Health Care,Major Pharmaceuticals
JVA,Coffee Holding Co. Inc. Common Stock,$5.33,0.07,1.331%,30426833.00,United States,2005,19079,Consumer Non-Durables,Specialty Foods
JWEL,Jowell Global Ltd. Ordinary Shares,$6.4194,-0.3906,-5.736%,163186630.00,China,2021,21370,Consumer Services,Other Consumer Services
JYAC,Jiya Acquisition Corp. Class A Common Stock,$9.9204,-0.0796,-0.796%,133400522.00,United States,2020,1390,,
JYNT,The Joint Corp. Common Stock,$77.79,2.74,3.651%,1106694993.00,United States,2014,113987,Miscellaneous,Multi-Sector Companies
JZXN,Jiuzi Holdings Inc. Ordinary Shares,$8.35,0.66,8.583%,168670000.00,China,2021,341115,Consumer Durables,Automotive Aftermarket
KAII,Kismet Acquisition Two Corp. Class A Ordinary Shares,$9.70,0.01,0.103%,283725000.00,United States,2021,5000,Finance,Business Services
KAIIU,Kismet Acquisition Two Corp. Unit,$9.95,0.00,0.00%,0.00,United States,2021,4,Finance,Business Services
KAIIW,Kismet Acquisition Two Corp. Warrant,$0.803,0.0527,7.024%,0.00,United States,2021,3300,Finance,Business Services
KAIR,Kairos Acquisition Corp. Class A Ordinary Shares,$9.71,-0.03,-0.308%,334995000.00,United States,2021,7697,Finance,Business Services
KAIRU,Kairos Acquisition Corp. Unit,$9.95,0.00,0.00%,0.00,United States,2021,20,Finance,Business Services
KAIRW,Kairos Acquisition Corp. Warrant,$0.77,0.00,0.00%,0.00,United States,2021,993,Finance,Business Services
KALA,Kala Pharmaceuticals Inc. Common Stock,$5.65,-0.21,-3.584%,316738237.00,United States,2017,815323,Health Care,Major Pharmaceuticals
KALU,Kaiser Aluminum Corporation Common Stock,$125.80,1.63,1.313%,1993670600.00,United States,,33862,Basic Industries,Aluminum
KALV,KalVista Pharmaceuticals Inc. Common Stock,$26.65,-1.38,-4.923%,650866794.00,United Kingdom,2015,63791,Health Care,Major Pharmaceuticals
KARO,Karooooo Ltd. Ordinary Shares,$36.42,0.85,2.39%,784501149.00,Singapore,2021,33221,Technology,Computer Software: Prepackaged Software
KBAL,Kimball International Inc. Class B Common Stock,$13.18,0.34,2.648%,484823163.00,United States,,31806,Consumer Durables,Industrial Specialties
KBNT,Kubient Inc. Common Stock,$5.15,-0.09,-1.718%,72009726.00,United States,2020,68063,Technology,EDP Services
KBNTW,Kubient Inc. Warrant,$1.96,0.1087,5.872%,0.00,United States,2020,6214,Technology,EDP Services
KBSF,KBS Fashion Group Limited Common Stock,$4.03,0.01,0.249%,10442935.00,China,2013,8370,Consumer Non-Durables,Apparel
KC,Kingsoft Cloud Holdings Limited American Depositary Shares,$33.05,-1.50,-4.342%,7380867685.00,China,2020,663275,Technology,Computer Software: Prepackaged Software
KDMN,Kadmon Holdings Inc. Common Stock,$3.965,-0.025,-0.627%,681876371.00,United States,,647836,Health Care,Major Pharmaceuticals
KDNY,Chinook Therapeutics Inc. Common Stock,$15.27,0.09,0.593%,681290840.00,United States,2015,210824,Health Care,Major Pharmaceuticals
KDP,Keurig Dr Pepper Inc. Common Stock,$34.315,-0.205,-0.594%,48638863897.00,United States,,2080211,Consumer Non-Durables,Beverages (Production/Distribution)
KE,Kimball Electronics Inc. Common Stock,$21.27,0.63,3.052%,530836687.00,United States,,45530,Capital Goods,Industrial Machinery/Components
KELYA,Kelly Services Inc. Class A Common Stock,$24.5499,1.0199,4.334%,966506142.00,United States,,56084,Technology,Diversified Commercial Services
KELYB,Kelly Services Inc. Class B Common Stock,$23.80,0.00,0.00%,936983295.00,United States,,257,Technology,Diversified Commercial Services
KEQU,Kewaunee Scientific Corporation Common Stock,$12.8881,0.3881,3.105%,35607204.00,United States,,5754,Capital Goods,Medical Specialities
KERN,Akerna Corp. Common Stock,$4.11,-0.07,-1.675%,57781286.00,United States,2018,546938,Health Care,Managed Health Care
KERNW,Akerna Corp Warrant,$1.019,-0.0311,-2.962%,0.00,United States,2018,3255,Health Care,Managed Health Care
KFFB,Kentucky First Federal Bancorp Common Stock,$7.24,0.00,0.00%,59561417.00,United States,,50,Finance,Savings Institutions
KFRC,Kforce Inc. Common Stock,$60.56,1.74,2.958%,1327168524.00,United States,1995,20658,Technology,Diversified Commercial Services
KHC,The Kraft Heinz Company Common Stock,$40.695,0.195,0.481%,49775981001.00,United States,,2272129,Consumer Non-Durables,Farming/Seeds/Milling
KIDS,OrthoPediatrics Corp. Common Stock,$65.00,1.16,1.817%,1277836105.00,United States,2017,36080,Health Care,Medical/Dental Instruments
KIII,Kismet Acquisition Three Corp. Class A Ordinary Shares,$9.67,0.00,0.00%,352350625.00,United States,2021,19,Finance,Business Services
KIIIU,Kismet Acquisition Three Corp. Unit,$9.99,0.00,0.00%,0.00,United States,2021,691,Finance,Business Services
KIIIW,Kismet Acquisition Three Corp. Warrant,$0.9001,0.063,7.526%,0.00,United States,2021,1000,Finance,Business Services
KIN,Kindred Biosciences Inc. Common Stock,$9.205,0.015,0.163%,417267888.00,United States,2013,898790,Health Care,Major Pharmaceuticals
KINS,Kingstone Companies Inc. Common Stock,$8.148,-0.142,-1.713%,87025961.00,United States,,3113,Finance,Specialty Insurers
KINZ,KINS Technology Group Inc. Class A Common Stock,$9.90,-0.02,-0.202%,341550000.00,United States,2021,5103,,
KINZU,KINS Technology Group Inc. Unit,$10.12,0.00,0.00%,0.00,United States,2020,1021,,
KINZW,KINS Technology Group Inc. Warrant,$0.799,-0.01,-1.236%,0.00,United States,2021,149,Finance,Business Services
KIRK,Kirkland's Inc. COMMONSTOCK,$22.61,0.82,3.763%,322250811.00,United States,2002,450715,Miscellaneous,Diversified Commercial Services
KLAC,KLA Corporation Common Stock,$309.27,4.79,1.573%,47405457028.00,United States,1980,332878,Capital Goods,Electronic Components
KLAQ,KL Acquisition Corp Class A Common Stock,$9.70,-0.01,-0.103%,348593750.00,United States,2021,21621,,
