Symbol,Name,Last Sale,Net Change,% Change,Market Cap,Country,IPO Year,Volume,Sector,Industry
PTE,PolarityTE Inc. Common Stock,$1.025,-0.075,-6.818%,82648923.00,United States,,1126109,Consumer Durables,Specialty Chemicals
PTEN,Patterson-UTI Energy Inc. Common Stock,$10.27,0.48,4.903%,1936059454.00,United States,1993,604808,Energy,Oil & Gas Production
PTGX,Protagonist Therapeutics Inc. Common Stock,$43.73,1.26,2.967%,1921722109.00,United States,2016,180189,Health Care,Major Pharmaceuticals
PTIC,PropTech Investment Corporation II Class A Common Stock,$9.82,-0.02,-0.203%,282325000.00,United States,2021,4381,,
PTICU,PropTech Investment Corporation II Unit,$10.00,0.00,0.00%,0.00,United States,2020,2,,
PTICW,PropTech Investment Corporation II Warrant,$0.9501,0.0402,4.418%,0.00,United States,2021,11254,Finance,Business Services
PTIX,Protagenic Therapeutics Inc. Common Stock,$2.80,-0.14,-4.762%,41002584.00,United States,,925623,Health Care,Major Pharmaceuticals
PTIXW,Protagenic Therapeutics Inc. Warrant,$0.67,0.0422,6.722%,0.00,United States,,3800,,
PTMN,Portman Ridge Finance Corporation Common Stock,$2.425,0.085,3.632%,222685080.00,United States,,156776,Finance,Finance/Investors Services
PTNR,Partner Communications Company Ltd. American Depositary Shares,$5.0594,0.1394,2.833%,930451552.00,Israel,,14188,Public Utilities,Telecommunications Equipment
PTOC,Pine Technology Acquisition Corp. Class A Common Stock,$9.74,0.00,0.00%,420037500.00,United States,2021,4,Finance,Business Services
PTOCU,Pine Technology Acquisition Corp. Unit,$9.96,0.00,0.00%,0.00,United States,2021,3395,,
PTOCW,Pine Technology Acquisition Corp. Warrant,$0.70,0.00,0.00%,0.00,United States,2021,10099,Finance,Business Services
PTON,Peloton Interactive Inc. Class A Common Stock,$107.84,-1.28,-1.173%,32167946560.00,United States,2019,4518974,Consumer Services,Other Consumer Services
PTPI,Petros Pharmaceuticals Inc. Common Stock,$3.4028,-0.0572,-1.653%,33341523.00,United States,,13384,Health Care,Major Pharmaceuticals
PTRA,Proterra Inc. Common Stock,$16.2199,-0.6301,-3.739%,0.00,United States,2020,721831,,
PTRAW,Proterra Inc. Warrant,$5.2606,-0.2894,-5.214%,0.00,United States,2020,223876,,
PTRS,Partners Bancorp Common Stock,$7.665,-0.105,-1.351%,135874757.00,United States,,14064,Finance,Major Banks
PTSI,P.A.M. Transportation Services Inc. Common Stock,$52.50,-0.40,-0.756%,300627758.00,United States,1986,8157,Transportation,Trucking Freight/Courier Services
PTVE,Pactiv Evergreen Inc. Common stock,$15.46,0.32,2.114%,2738858197.00,United States,2020,83088,Consumer Durables,Containers/Packaging
PUBM,PubMatic Inc. Class A Common Stock,$33.43,-0.28,-0.831%,1598840029.00,United States,2020,738134,Technology,Computer Software: Prepackaged Software
PUCK,Goal Acquisitions Corp. Common Stock,$9.64,0.01,0.104%,319674450.00,United States,2021,5947,,
PUCKU,Goal Acquisitions Corp. Unit,$10.221,-0.009,-0.088%,0.00,United States,2021,10170,,
PUCKW,Goal Acquisitions Corp. Warrant,$0.6254,0.0054,0.871%,0.00,United States,2021,10375,Finance,Business Services
PULM,Pulmatrix Inc. Common Stock,$1.0201,-0.0099,-0.961%,57379668.00,United States,2014,264778,Health Care,Major Pharmaceuticals
PUYI,Puyi Inc. American Depository Shares,$5.3001,-0.4499,-7.824%,319673814.00,China,2019,327,Finance,Investment Managers
PVAC,Penn Virginia Corporation Common Stock,$23.54,0.69,3.02%,891175672.00,United States,,102952,Energy,Oil & Gas Production
PVBC,Provident Bancorp Inc. (MD) Common Stock,$16.51,0.16,0.979%,302713194.00,United States,2015,14563,Finance,Major Banks
PWFL,PowerFleet Inc. Common Stock,$6.80,-0.28,-3.955%,244734734.00,United States,,100288,Capital Goods,Telecommunications Equipment
PWOD,Penns Woods Bancorp Inc. Common Stock,$23.85,0.21,0.888%,168400772.00,United States,,14350,Finance,Major Banks
PXLW,Pixelworks Inc.  Common Stock,$3.31,0.03,0.915%,172823114.00,United States,2000,221448,Technology,Semiconductors
PXS,Pyxis Tankers Inc. Common Stock,$0.8877,0.0421,4.979%,19138710.00,Greece,,1736289,Transportation,Marine Transportation
PXSAP,Pyxis Tankers Inc. 7.75% Series A Cumulative Convertible Preferred Shares,$24.30,0.00,0.00%,0.00,Greece,,62,Transportation,Marine Transportation
PXSAW,Pyxis Tankers Inc. Warrant,$0.3097,-0.0003,-0.097%,0.00,Greece,,697,Transportation,Marine Transportation
PYPD,PolyPid Ltd. Ordinary Shares,$9.0883,-0.1217,-1.321%,170361474.00,Israel,2020,11510,Health Care,Medical/Dental Instruments
PYPL,PayPal Holdings Inc. Common Stock,$282.535,-0.845,-0.298%,331901790737.00,United States,,3898938,Miscellaneous,Business Services
PYR,PyroGenesis Canada Inc. Common Shares,$6.13,-0.20,-3.16%,1021892179.00,Canada,,130620,,
PZZA,Papa John's International Inc. Common Stock,$105.77,1.93,1.859%,3864621087.00,United States,1993,113318,Consumer Services,Restaurants
QADA,QAD Inc. Class A Common Stock,$73.01,0.08,0.11%,1512177279.00,United States,,20752,Technology,Computer Software: Prepackaged Software
QADB,QAD Inc. Class B Common Stock,$48.86,-1.6405,-3.248%,1011984411.00,United States,,253,Technology,Computer Software: Prepackaged Software
QCOM,QUALCOMM Incorporated Common Stock,$133.735,0.735,0.553%,150853080000.00,United States,1991,2405708,Technology,Computer peripheral equipment
QCRH,QCR Holdings Inc. Common Stock,$47.82,1.55,3.35%,757799619.00,United States,,13832,Finance,Major Banks
QDEL,Quidel Corporation Common Stock,$110.76,-3.04,-2.671%,4712928380.00,United States,,223264,Health Care,Biotechnology: In Vitro & In Vivo Diagnostic Substances
QELL,Qell Acquisition Corp. Class A Ordinary Shares,$9.9501,0.0101,0.102%,472007869.00,United States,2020,205258,Finance,Business Services
QELLU,Qell Acquisition Corp. Unit,$10.51,0.01,0.095%,0.00,United States,2020,4101,Finance,Business Services
QELLW,Qell Acquisition Corp. Warrant,$1.64,-0.01,-0.606%,0.00,United States,2020,88945,Finance,Business Services
QFIN,360 DigiTech Inc. American Depositary Shares,$41.28,-1.92,-4.444%,6290906921.00,China,2018,1779572,Finance,Finance: Consumer Services
QH,Quhuo Limited American Depository Shares,$3.7275,-0.1225,-3.182%,195300536.00,China,2020,32762,Miscellaneous,Business Services
QIPT,Quipt Home Medical Corp. Common Shares,$5.51,-0.07,-1.254%,169204926.00,United States,,81043,Capital Goods,Office Equipment/Supplies/Services
QIWI,QIWI plc American Depositary Shares,$10.57,0.00,0.00%,662876146.00,Cyprus,2013,180572,Miscellaneous,Business Services
QK,Q&K International Group Limited American Depositary Shares,$1.27,-0.01,-0.781%,68848390.00,China,2019,939593,Finance,Real Estate
QLGN,Qualigen Therapeutics Inc. Common Stock,$1.93,-0.08,-3.98%,55647804.00,United States,2015,119656,Health Care,Biotechnology: Commercial Physical & Biological Resarch
QLI,Qilian International Holding Group Ltd. Ordinary Shares,$4.45,-0.07,-1.549%,159087500.00,China,2021,28097,Health Care,Major Pharmaceuticals
QLYS,Qualys Inc. Common Stock,$104.75,-1.20,-1.133%,4100112663.00,United States,2012,166548,Technology,Computer Software: Prepackaged Software
QMCO,Quantum Corporation Common Stock,$7.81,0.19,2.493%,445849165.00,United States,,229796,Technology,Electronic Components
QNST,QuinStreet Inc. Common Stock,$18.39,0.34,1.884%,986062072.00,United States,2010,70932,Technology,Advertising
QQQX,Nuveen NASDAQ 100 Dynamic Overwrite Fund Shares of Beneficial Interest,$28.6245,0.0045,0.016%,1204116786.00,United States,,72855,Finance,Finance Companies
QRHC,Quest Resource Holding Corporation Common Stock,$5.8256,-0.8044,-12.133%,109058063.00,United States,,322350,Capital Goods,Building Products
QRTEA,Qurate Retail Inc. Series A Common Stock ,$12.90,0.08,0.624%,5310703076.00,United States,,752207,Consumer Services,Catalog/Specialty Distribution
QRTEB,Qurate Retail Inc. Series B Common Stock ,$12.9776,0.00,0.00%,5342649631.00,United States,,88,Consumer Services,Catalog/Specialty Distribution
QRTEP,Qurate Retail Inc. 8.0% Fixed Rate Cumulative Redeemable Preferred Stock,$108.10,-0.38,-0.35%,0.00,United States,,7114,Consumer Services,Catalog/Specialty Distribution
QRVO,Qorvo Inc. Common Stock,$175.94,1.75,1.005%,19808523703.00,United States,,289570,Capital Goods,Industrial Machinery/Components
QSI,Quantum-Si Incorporated Class A Common Stock,$9.50,0.28,3.037%,1295806270.00,United States,2020,611483,,
QSIAW,Quantum-Si Incorporated Warrant,$2.50,0.06,2.459%,0.00,United States,2020,73628,,
QTNT,Quotient Limited Ordinary Shares,$4.03,-0.32,-7.356%,409155035.00,Switzerland,2014,384097,Health Care,Biotechnology: In Vitro & In Vivo Diagnostic Substances
QTRX,Quanterix Corporation Common Stock,$62.94,-1.50,-2.328%,2287025478.00,United States,2017,113748,Health Care,Industrial Specialties
QTT,Qutoutiao Inc. American Depositary Shares,$1.83,-0.07,-3.684%,526109906.00,China,2018,669306,Technology,Computer Software: Prepackaged Software
QUIK,QuickLogic Corporation Common Stock,$6.30,-0.10,-1.563%,72136796.00,United States,1999,20743,Technology,Semiconductors
QUMU,Qumu Corporation Common Stock,$2.945,-0.005,-0.169%,51807771.00,United States,,53882,Technology,Retail: Computer Software & Peripheral Equipment
QURE,uniQure N.V. Ordinary Shares,$32.54,-0.33,-1.004%,1494390682.00,Netherlands,2014,99193,Health Care,Major Pharmaceuticals
RAAC,Revolution Acceleration Acquisition Corp Class A Common Stock,$9.9482,-0.0118,-0.118%,381347663.00,United States,2021,51450,,
RAACU,Revolution Acceleration Acquisition Corp Unit,$10.63,0.00,0.00%,0.00,United States,2020,2,,
RAACW,Revolution Acceleration Acquisition Corp Warrant,$2.14,0.12,5.941%,0.00,United States,2021,4783,Finance,Business Services
RACA,Therapeutics Acquisition Corp. Class A Common Stock,$9.985,-0.005,-0.05%,174073498.00,United States,2020,14601,Health Care,Major Pharmaceuticals
RACB,Research Alliance Corp. II Class A Common Stock,$10.00,0.00,0.00%,191865000.00,United States,2021,3,,
RADA,RADA Electronic Industries Ltd. Ordinary Shares,$12.93,0.12,0.937%,562261890.00,Israel,,196112,,
RADI,Radius Global Infrastructure Inc. Class A Common Stock,$15.02,0.03,0.20%,919444914.00,United States,,102536,Consumer Services,Telecommunications Equipment
RAIL,FreightCar America Inc. Common Stock,$5.6227,0.2627,4.901%,87387554.00,United States,2005,344985,Capital Goods,Railroads
RAIN,Rain Therapeutics Inc. Common Stock,$17.81,-0.24,-1.33%,471656175.00,United States,2021,28023,Health Care,Major Pharmaceuticals
RAMMU,Aries I Acquisition Corporation Unit,$10.0388,-0.0011,-0.011%,0.00,Cayman Islands,2021,5553,Finance,Business Services
RAND,Rand Capital Corporation Common Stock,$17.06,-1.20,-6.572%,44051803.00,United States,,550,Finance,Finance/Investors Services
RAPT,RAPT Therapeutics Inc. Common Stock,$35.345,0.775,2.242%,883943352.00,United States,2019,287488,Health Care,Major Pharmaceuticals
RARE,Ultragenyx Pharmaceutical Inc. Common Stock,$96.36,1.44,1.517%,6502636152.00,United States,2014,514918,Health Care,Major Pharmaceuticals
RAVE,Rave Restaurant Group Inc. Common Stock,$1.38,-0.04,-2.817%,24846768.00,United States,,65020,Consumer Services,Restaurants
RAVN,Raven Industries Inc. Common Stock,$57.7702,19.1502,49.586%,2074969073.00,United States,,4582529,Capital Goods,Office Equipment/Supplies/Services
RBB,RBB Bancorp Common Stock,$23.39,0.38,1.651%,457794319.00,United States,2017,17661,Finance,Commercial Banks
RBBN,Ribbon Communications Inc. Common Stock,$7.52,0.12,1.622%,1108203367.00,United States,,148446,Technology,EDP Services
RBCAA,Republic Bancorp Inc. Class A Common Stock,$46.53,1.26,2.783%,967413466.00,United States,1998,22453,Finance,Major Banks
RBCN,Rubicon Technology Inc. Common Stock,$9.85,0.01,0.102%,24048233.00,United States,2007,382,Technology,Semiconductors
RBKB,Rhinebeck Bancorp Inc. Common Stock,$10.7802,-0.0098,-0.091%,120019093.00,United States,2019,408,Finance,Major Banks
RBNC,Reliant Bancorp Inc. Common Stock,$28.13,1.13,4.185%,461521034.00,United States,,13033,Finance,Major Banks
RCAT,Red Cat Holdings Inc. Common Stock,$2.49,-0.31,-11.071%,84333935.00,United States,,277077,Technology,Retail: Computer Software & Peripheral Equipment
RCEL,Avita Therapeutics Inc. Common Stock,$21.40,0.76,3.682%,531637696.00,Australia,,80246,Health Care,Medical Specialities
RCHG,Recharge Acquisition Corp. Class A Common Stock,$9.81,-0.04,-0.406%,245740500.00,United States,2020,6811,,
RCHGU,Recharge Acquisition Corp. Unit,$10.18,0.09,0.892%,0.00,United States,2020,4500,,
RCHGW,Recharge Acquisition Corp. Warrant,$0.74,-0.0093,-1.241%,0.00,United States,2020,6500,Finance,Business Services
RCII,Rent-A-Center Inc. Common Stock,$55.11,1.22,2.264%,3654308168.00,United States,1995,374782,Technology,Diversified Commercial Services
RCKT,Rocket Pharmaceuticals Inc. Common Stock,$44.01,1.00,2.325%,2790099946.00,United States,2015,73570,Health Care,Major Pharmaceuticals
RCKY,Rocky Brands Inc. Common Stock,$55.29,1.47,2.731%,402701066.00,United States,1993,18925,Consumer Non-Durables,Shoe Manufacturing
RCLF,Rosecliff Acquisition Corp I Class A Common Stock,$9.695,0.025,0.259%,306604375.00,United States,2021,603,,
RCLFU,Rosecliff Acquisition Corp I Unit,$9.91,-0.07,-0.701%,0.00,United States,2021,2946,,
RCLFW,Rosecliff Acquisition Corp I Warrants,$0.7225,-0.0274,-3.654%,0.00,United States,2021,1000,Finance,Business Services
RCM,R1 RCM Inc. Common Stock,$22.15,0.65,3.023%,6172860169.00,United States,,664677,Consumer Services,Other Consumer Services
RCMT,RCM Technologies Inc. Common Stock,$3.735,-0.085,-2.225%,41417729.00,United States,,14365,Consumer Services,Military/Government/Technical
RCON,Recon Technology Ltd. Class A Ordinary Shares,$3.82,-0.10,-2.551%,27514818.00,China,2009,3779479,Energy,Oilfield Services/Equipment
RDCM,Radcom Ltd. Ordinary Shares,$10.25,0.25,2.50%,142922474.00,Israel,1997,1784,Technology,Computer peripheral equipment
RDFN,Redfin Corporation Common Stock,$59.10,-0.31,-0.522%,6148853300.00,United States,2017,499212,Finance,Real Estate
RDHL,Redhill Biopharma Ltd. American Depositary Shares,$7.02,0.05,0.717%,327974491.00,Israel,,119094,Health Care,Major Pharmaceuticals
RDI,Reading International Inc Class A Common Stock,$6.6487,-0.1213,-1.792%,145004178.00,United States,,9977,Consumer Services,Movies/Entertainment
RDIB,Reading International Inc Class B Common Stock,$23.57,0.77,3.377%,514047629.00,United States,,2295,Consumer Services,Movies/Entertainment
RDNT,RadNet Inc. Common Stock,$34.12,1.62,4.985%,1798125331.00,United States,,199919,Health Care,Medical Specialities
RDUS,Radius Health Inc. Common Stock,$19.07,0.54,2.914%,900917507.00,United States,2014,180590,Health Care,Major Pharmaceuticals
RDVT,Red Violet Inc. Common Stock ,$20.325,0.255,1.271%,248813609.00,United States,,11742,Technology,Computer Software: Prepackaged Software
RDWR,Radware Ltd. Ordinary Shares,$30.715,0.255,0.837%,1398605682.00,Israel,1999,98812,Technology,EDP Services
REAL,The RealReal Inc. Common Stock,$20.28,0.62,3.154%,1841620209.00,United States,2019,472358,Consumer Services,Catalog/Specialty Distribution
REAX,The Real Brokerage Inc. Common Shares,$9.43,-0.215,-2.229%,338094412.00,Canada,,17860,,
REDU,RISE Education Cayman Ltd American Depositary Shares,$2.81,-0.09,-3.103%,158716966.00,China,2017,34835,Miscellaneous,Service to the Health Industry
REED,Reeds Inc. Common Stock,$1.05,-0.02,-1.869%,98263599.00,United States,,424919,Consumer Non-Durables,Beverages (Production/Distribution)
REFR,Research Frontiers Incorporated Common Stock,$2.08,0.00,0.00%,65832824.00,United States,,66752,Capital Goods,Industrial Machinery/Components
REG,Regency Centers Corporation Common Stock,$65.15,1.82,2.874%,11066519724.00,United States,1993,253326,Consumer Services,Real Estate Investment Trusts
REGI,Renewable Energy Group Inc. Common Stock,$64.275,1.255,1.991%,3063506673.00,United States,2012,456247,Basic Industries,Major Chemicals
REGN,Regeneron Pharmaceuticals Inc. Common Stock,$541.70,3.78,0.703%,57714779169.00,United States,1991,296974,Health Care,Major Pharmaceuticals
REKR,Rekor Systems Inc. Common Stock,$10.67,0.17,1.619%,437411422.00,United States,,391406,Technology,EDP Services
RELI,Reliance Global Group Inc. Common Stock,$3.61,-0.18,-4.749%,39455546.00,United States,,10996,Finance,Specialty Insurers
RELIW,Reliance Global Group Inc. Series A Warrants,$0.46,0.0398,9.472%,0.00,United States,,200,Consumer Services,Broadcasting
RELL,Richardson Electronics Ltd. Common Stock,$8.08,0.09,1.126%,106717844.00,United States,1983,11501,Technology,Electronic Components
REPH,Recro Pharma Inc. Common Stock,$2.00,0.00,0.00%,92718958.00,United States,2014,166795,Health Care,Major Pharmaceuticals
REPL,Replimune Group Inc. Common Stock,$35.61,0.21,0.593%,1659744994.00,United States,2018,132276,Health Care,Major Pharmaceuticals
RESN,Resonant Inc. Common Stock,$3.3581,-0.0519,-1.522%,202906889.00,United States,2014,655373,Technology,Semiconductors
RETA,Reata Pharmaceuticals Inc. Class A Common Stock,$139.025,1.025,0.743%,5043522813.00,United States,2016,145163,Health Care,Major Pharmaceuticals
RETO,ReTo Eco-Solutions Inc. Common Shares,$1.18,0.01,0.855%,29659300.00,China,2017,87187,Capital Goods,Multi-Sector Companies
REVH,Revolution Healthcare Acquisition Corp. SAIL Class A Common Stock,$9.85,-0.10,-1.005%,568837500.00,United States,2021,17879,,
REVHU,Revolution Healthcare Acquisition Corp. SAIL Units,$10.13,0.02,0.198%,0.00,United States,2021,1110,Finance,Business Services
REVHW,Revolution Healthcare Acquisition Corp. SAIL Warrant.,$1.46,-0.04,-2.667%,0.00,United States,2021,1978,,
REYN,Reynolds Consumer Products Inc. Common Stock,$29.55,-0.27,-0.905%,6198366689.00,United States,2020,135237,Capital Goods,Office Equipment/Supplies/Services
RFIL,RF Industries Ltd. Common Stock,$7.52,0.13,1.759%,75207941.00,United States,,20900,Capital Goods,Electrical Products
RGCO,RGC Resources Inc. Common Stock,$22.89,0.36,1.598%,188356522.00,United States,,28509,Public Utilities,Oil & Gas Production
RGEN,Repligen Corporation Common Stock,$198.92,1.58,0.801%,10921596377.00,United States,1986,106192,Health Care,Medical/Dental Instruments
RGLD,Royal Gold Inc. Common Stock,$110.32,1.01,0.924%,7237708639.00,United States,,143872,,
RGLS,Regulus Therapeutics Inc. Common Stock,$0.9562,0.0774,8.807%,71642004.00,United States,2012,4607463,Health Care,Major Pharmaceuticals
RGNX,REGENXBIO Inc. Common Stock,$38.91,1.17,3.10%,1654039431.00,United States,2015,72244,Health Care,Biotechnology: Biological Products (No Diagnostic Substances)
RGP,Resources Connection Inc. Common Stock,$14.54,0.22,1.536%,477246740.00,United States,,20479,Miscellaneous,Business Services
RIBT,RiceBran Technologies Common Stock,$1.07,0.00,0.00%,48633604.00,United States,,69101,Consumer Non-Durables,Specialty Foods
RICK,RCI Hospitality Holdings Inc. Common Stock,$65.305,1.865,2.94%,587739123.00,United States,1995,24801,Consumer Services,Restaurants
RIDE,Lordstown Motors Corp. Class A Common Stock,$10.2814,-0.3686,-3.461%,1815483196.00,United States,2019,4904258,Capital Goods,Construction/Ag Equipment/Trucks
RIGL,Rigel Pharmaceuticals Inc. Common Stock,$4.29,0.07,1.659%,730004989.00,United States,2000,822902,Health Care,Major Pharmaceuticals
RILY,B. Riley Financial Inc. Common Stock,$71.13,3.02,4.434%,1934373877.00,United States,,105999,Finance,Investment Managers
RILYG,B. Riley Financial Inc. 7.25% Senior Notes due 2027,$25.4299,0.0199,0.078%,0.00,United States,,4449,Miscellaneous,Business Services
RILYH,B. Riley Financial Inc. 7.375% Senior Notes due 2023,$25.80,0.059,0.229%,0.00,United States,,3375,Miscellaneous,Business Services
RILYI,B. Riley Financial Inc. 6.875% Senior Notes due 2023,$25.75,0.00,0.00%,0.00,United States,,60,Miscellaneous,Business Services
RILYK,B. Riley Financial Inc. 5.50% Senior Notes Due 2026,$25.13,0.04,0.159%,0.00,United States,,21997,Miscellaneous,Business Services
RILYL,B. Riley Financial Inc. Depositary Shares each representing 1/1000th in a share of 7.375% Series B Cumulative Perpetual Preferred Stock par value $0.0001,$27.52,0.02,0.073%,0.00,United States,,1609,Finance,Investment Managers
RILYM,B. Riley Financial Inc. 6.375% Senior Notes due 2025,$25.60,-0.04,-0.156%,0.00,United States,,7500,Miscellaneous,Business Services
RILYN,B. Riley Financial Inc. 6.50% Senior Notes Due 2026,$26.07,0.07,0.269%,0.00,United States,,24625,Miscellaneous,Business Services
RILYO,B. Riley Financial Inc. 6.75% Senior Notes due 2024,$25.7999,0.0099,0.038%,0.00,United States,,1404,Miscellaneous,Business Services
RILYP,B. Riley Financial Inc. Depositary Shares each representing a 1/1000th fractional interest in a share of Series A Cumulative Perpetual Preferred Stock,$26.755,0.005,0.019%,0.00,United States,,3420,Finance,Investment Managers
RILYT,B. Riley Financial Inc. 6.00% Senior Notes Due 2028,$25.6499,-0.0501,-0.195%,0.00,United States,,7750,Miscellaneous,Business Services
RIOT,Riot Blockchain Inc.  Common Stock ,$31.635,-0.545,-1.694%,3035211597.00,United States,,7275310,Technology,Retail: Computer Software & Peripheral Equipment
RIVE,Riverview Financial Corporation Common Stock,$12.81,0.01,0.078%,119785810.00,United States,,4881,Finance,Major Banks
RKDA,Arcadia Biosciences Inc. Common Stock,$2.72,-0.17,-5.882%,58034597.00,United States,2015,668277,Basic Industries,Agricultural Chemicals
RLAY,Relay Therapeutics Inc. Common Stock,$35.00,-0.34,-0.962%,3233382600.00,United States,2020,320697,Health Care,Major Pharmaceuticals
RLMD,Relmada Therapeutics Inc. Common Stock,$31.31,0.41,1.327%,525890180.00,United States,,16385,Health Care,Major Pharmaceuticals
RMBI,Richmond Mutual Bancorporation Inc. Common Stock,$14.11,0.09,0.642%,181790460.00,United States,2019,21433,,
RMBL,RumbleOn Inc. Class B Common Stock,$36.10,-0.25,-0.688%,122489538.00,United States,,31254,Capital Goods,Automotive Aftermarket
RMBS,Rambus Inc. Common Stock,$22.705,0.435,1.953%,2554431792.00,United States,1997,516322,Technology,Semiconductors
RMCF,Rocky Mountain Chocolate Factory Inc. Common Stock,$6.63,0.65,10.87%,40568937.00,United States,,98004,Consumer Non-Durables,Specialty Foods
RMGB,RMG Acquisition Corp. II Class A Ordinary Shares,$9.93,-0.06,-0.601%,428231250.00,United States,2021,52263,Finance,Business Services
RMGBU,RMG Acquisition Corp. II Unit,$10.54,-0.08,-0.753%,0.00,United States,2020,2332,Finance,Business Services
RMGBW,RMG Acquisition Corp. II Warrant,$1.81,-0.02,-1.093%,0.00,United States,2021,24225,Finance,Business Services
RMGC,RMG Acquisition Corp. III Class A Ordinary Shares,$9.78,0.00,0.00%,590467500.00,United States,2021,7758,Finance,Business Services
RMGCU,RMG Acquisition Corp. III Unit,$9.98,-0.02,-0.20%,0.00,United States,2021,1000,Finance,Business Services
RMGCW,RMG Acquisition Corp. III Warrant,$1.12,-0.07,-5.882%,0.00,United States,2021,2700,Finance,Business Services
RMNI,Rimini Street Inc. (DE) Common Stock,$6.64,0.14,2.154%,566166240.00,United States,2015,347291,Technology,EDP Services
RMR,The RMR Group Inc. Class A Common Stock,$40.23,1.04,2.654%,660302674.00,United States,,42211,Finance,Real Estate
RMRM,RMR Mortgage Trust Common Stock,$12.00,-0.02,-0.166%,122604096.00,United States,,12141,Consumer Services,Real Estate Investment Trusts
RMTI,Rockwell Medical Inc. (DE) Common Stock,$0.8584,-0.0164,-1.875%,80370903.00,United States,1998,528578,Health Care,Major Pharmaceuticals
RNA,Avidity Biosciences Inc. Common Stock,$26.30,-0.51,-1.902%,989281364.00,United States,2020,43730,Health Care,Major Pharmaceuticals
RNDB,Randolph Bancorp Inc. Common Stock,$22.5996,0.3496,1.571%,119910788.00,United States,2016,2196,Finance,Major Banks
RNLX,Renalytix AI plc American Depositary Shares,$31.96,-0.48,-1.48%,1151315630.00,United Kingdom,2020,32341,Health Care,Medical Specialities
RNST,Renasant Corporation Common Stock,$40.97,1.30,3.277%,2307191381.00,United States,,63915,Finance,Major Banks
RNWK,RealNetworks Inc. Common Stock,$2.37,0.05,2.155%,111170545.00,United States,1997,396263,Technology,EDP Services
ROAD,Construction Partners Inc. Class A Common Stock,$30.39,1.33,4.577%,1589168406.00,United States,2018,142239,Capital Goods,Engineering & Construction
ROCC,Roth CH Acquisition II Co. Common Stock,$9.91,-0.01,-0.101%,145181500.00,United States,2021,111490,,
ROCCU,Roth CH Acquisition II Co. Unit,$10.6602,0.0352,0.331%,0.00,United States,2020,400,,
ROCCW,Roth CH Acquisition II Co. Warrant,$1.5108,-0.0192,-1.255%,0.00,United States,2021,17750,Finance,Business Services
ROCK,Gibraltar Industries Inc. Common Stock,$74.12,0.74,1.008%,2418509362.00,United States,1993,27506,,
ROCR,Roth CH Acquisition III Co. Common stock,$9.89,-0.05,-0.503%,146203870.00,United States,2021,179760,,
ROCRU,Roth CH Acquisition III Co. Unit,$10.36,0.02,0.193%,0.00,United States,2021,35949,,
ROCRW,Roth CH Acquisition III Co. Warrant,$1.96,0.25,14.62%,0.00,United States,2021,79825,Finance,Business Services
ROIC,Retail Opportunity Investments Corp. Common Stock (MD),$17.93,0.40,2.282%,2129684394.00,United States,,289984,Consumer Services,Real Estate Investment Trusts
ROKU,Roku Inc. Class A Common Stock,$383.0701,14.6401,3.974%,50717938430.00,United States,2017,4072244,Consumer Services,Television Services
ROLL,RBC Bearings Incorporated Common Stock,$196.06,5.38,2.821%,4945820343.00,United States,2005,33106,Capital Goods,Metal Fabrications
ROOT,Root Inc. Class A Common Stock,$10.74,0.03,0.28%,2716446849.00,United States,2020,816081,Finance,Property-Casualty Insurers
ROST,Ross Stores Inc. Common Stock,$119.04,3.78,3.28%,42511644200.00,United States,1985,939043,Consumer Services,Clothing/Shoe/Accessory Stores
RPAY,Repay Holdings Corporation Class A Common Stock,$24.95,0.12,0.483%,2258626395.00,United States,2018,151617,Technology,EDP Services
RPD,Rapid7 Inc. Common Stock,$95.76,1.78,1.894%,5279245161.00,United States,2015,174477,Technology,Computer Software: Prepackaged Software
RPHM,Reneo Pharmaceuticals Inc. Common Stock,$8.8849,0.2549,2.954%,215780929.00,United States,2021,95531,Health Care,Major Pharmaceuticals
RPRX,Royalty Pharma plc Class A Ordinary Shares ,$42.8157,-1.2043,-2.736%,25993946752.00,United States,2020,907446,Health Care,Major Pharmaceuticals
